{
 "schema": "wakeel.entry-contracts.v0.3",
 "date": "2026-10-25",
 "status": "DESIGN_CONTRACTS_NOT_CONTENT",
 "purpose_ar": "اختبار عملي لقاعدة «الموضوع مستقل الوصول»: لكل موضوع اختبار هنا يحدد ما يُشرح داخل الصفحة نفسها، وما لا يجوز أن يصبح شرط دخول.",
 "global_rules_ar": [
  "لا شرط إكمال رحلة للوصول إلى أي موضوع.",
  "لا شرط قراءة موضوع آخر كاملاً؛ يُسمح بشرح موجز داخل الصفحة.",
  "شرط التنفيذ (hard_implementation) يظهر كإحالة مساعدة لا كحجب.",
  "المستوى الأول من كل موضوع مفهوم بلا حساب، والمستوى الثالث فقط يحتاج أدوات."
 ],
 "contracts": [
  {
   "topic_id": "NLP-003",
   "entry_question_ar": "أرسل جملة عربية إلى نموذج؛ لماذا لا يقرأها بالضرورة كلمتين؟",
   "why_standalone_ar": "التقطيع عملية قابلة للملاحظة وحدها؛ لا تحتاج نموذجاً مدرّباً لتُفهم، لكن أغلب الشروح تؤجلها إلى سياق بناء نموذج.",
   "inline_explanations": [
    {
     "concept_ar": "النص تمثيل رقمي",
     "promise_ar": "سطران عن المحرف كوحدة تخزين، يكفيان لفهم لماذا يحتاج النص إلى تقطيع قبل أي حساب."
    },
    {
     "concept_ar": "الرمز Token",
     "promise_ar": "تعريف عملي: الوحدة التي يعدّها النظام، وقد تكون كلمة أو جزء كلمة أو محرفاً."
    },
    {
     "concept_ar": "معرّف الرمز Token ID",
     "promise_ar": "جملة واحدة: الرمز يُستبدل بفهرس في مفردة، والمفردة تُبنى مرة وتُثبّت."
    }
   ],
   "depth_levels": [
    {
     "level": "explore",
     "needs_ar": "لا شيء"
    },
    {
     "level": "experiment",
     "needs_ar": "نص جاهز للصق؛ لا برمجة"
    },
    {
     "level": "build",
     "needs_ar": "سلاسل ومصفوفات أساسية، ومقطع محدد الإصدار"
    },
    {
     "level": "research",
     "needs_ar": "مقارنة BPE وWordPiece وUnigram على نص واحد"
    }
   ],
   "forbidden_gates_ar": [
    "طلب إكمال رحلة النماذج اللغوية قبل عرض التقطيع",
    "طلب قراءة Embeddings قبل توضيح معرّف الرمز",
    "عرض نتيجة تقطيع غير منسوبة إلى مقطع محدد الإصدار"
   ],
   "proof_of_independence_ar": "يستطيع الزائر بعد الصفحة أن يقارن عدد رموز جملتين عربيتين وأن يفسر الفرق، دون أن يعرف ما هو النموذج اللغوي.",
   "linked_journey_id": "JRN-LLM-001",
   "linked_station_order": 8
  },
  {
   "topic_id": "DLN-017",
   "entry_question_ar": "كيف تقرر كلمة في جملة أي الكلمات الأخرى تهمها أكثر؟",
   "why_standalone_ar": "آلية الانتباه رياضياً صغيرة (ضرب مصفوفات وتطبيع) لكنها تُعرض عادة داخل سياق نموذج كامل، فتضيع الفكرة الأولى.",
   "inline_explanations": [
    {
     "concept_ar": "المتجه",
     "promise_ar": "تعريف بصري: قائمة أعداد تمثل موضعاً في فضاء، مع مثال من كلمتين."
    },
    {
     "concept_ar": "الضرب الداخلي",
     "promise_ar": "سطر عن قياس التوافق، مع حساب رقمي واحد باليد."
    },
    {
     "concept_ar": "Softmax",
     "promise_ar": "كيف تتحول درجات إلى أوزان مجموعها واحد، بمثال ثلاثة أرقام."
    }
   ],
   "depth_levels": [
    {
     "level": "explore",
     "needs_ar": "لا شيء"
    },
    {
     "level": "experiment",
     "needs_ar": "مصفوفة صغيرة جاهزة للتعديل"
    },
    {
     "level": "build",
     "needs_ar": "جبر خطي أساسي ومصفوفات"
    },
    {
     "level": "research",
     "needs_ar": "مقارنة آليات انتباه متعددة التعريف"
    }
   ],
   "forbidden_gates_ar": [
    "طلب إكمال موضوع Transformer قبل شرح الفكرة الأولى",
    "بدء الشرح بمعادلة بلا مثال محسوب يدوياً",
    "افتراض معرفة الانتشار العكسي للفهم"
   ],
   "proof_of_independence_ar": "يستطيع الزائر أن يحسب بيده وزن انتباه بين كلمتين ويشرح لماذا حصلت كلمة على وزن أعلى.",
   "linked_journey_id": "JRN-LLM-001",
   "linked_station_order": 18
  },
  {
   "topic_id": "EVA-011",
   "entry_question_ar": "لماذا قد ينفّذ نظام تعليمات جاءت في نص بريء نسخه المستخدم من صفحة؟",
   "why_standalone_ar": "المسألة أمنية وتُفهم من مثال نصي واحد؛ لا تحتاج تدريب نموذج ولا رياضيات، لكنها تُذكر عادة كحاشية في موضوعات الوكلاء.",
   "inline_explanations": [
    {
     "concept_ar": "تعليمات النظام",
     "promise_ar": "سطران: النص الذي يحدد سلوك النظام ولا يراه المستخدم عادة."
    },
    {
     "concept_ar": "المحتوى غير الموثوق",
     "promise_ar": "تعريف عملي: أي نص لم يؤلفه مالك النظام."
    },
    {
     "concept_ar": "حدود الثقة",
     "promise_ar": "مثال مصور: ما يمر من مصدر خارجي إلى سياق النموذج."
    }
   ],
   "depth_levels": [
    {
     "level": "explore",
     "needs_ar": "لا شيء"
    },
    {
     "level": "experiment",
     "needs_ar": "مثال نصي جاهز للمقارنة"
    },
    {
     "level": "build",
     "needs_ar": "فهم دورة استدعاء أداة واحدة"
    },
    {
     "level": "research",
     "needs_ar": "تصنيف أساليب الهجوم والدفاع مع مصادر مؤرخة"
    }
   ],
   "forbidden_gates_ar": [
    "طلب بناء وكيل كامل قبل شرح المثال",
    "عرض الهجوم كأنه حقيقي على نظام إنتاج دون سياق",
    "تقديم الدفاع كضمان مطلق"
   ],
   "proof_of_independence_ar": "يستطيع الزائر أن يميز نصاً يمكن أن يحمل تعليمات من نص عادي، ويشرح لماذا لا يكفي فلتر كلمات.",
   "linked_journey_id": null,
   "linked_station_order": null
  }
 ]
}
